{
  "$id": "ELadqKgkbacswVsGfxVCYHy4jyfN7W24vGHIR5pPjC18",
  "$schema": "https://json-schema.org/draft/2020-12/schema",
  "title": "SEDI Ward Core",
  "description": "Provisional Bakobo variant of Sam Smith's Core with an NI2I edge back to state-issued guardianship. Core attributes and utahAgent edge are retained.",
  "credentialType": "SEDI_Ward_Core_ACDC_acm_message",
  "version": "1.0.0",
  "type": "object",
  "required": [
    "v",
    "d",
    "i",
    "rd",
    "s",
    "a",
    "e",
    "r"
  ],
  "properties": {
    "v": {
      "description": "ACDC version string",
      "type": "string"
    },
    "t": {
      "description": "Message type",
      "type": "string"
    },
    "d": {
      "description": "Message SAID",
      "type": "string"
    },
    "u": {
      "description": "Message UE",
      "type": "string"
    },
    "i": {
      "description": "Issuer AID",
      "type": "string"
    },
    "rd": {
      "description": "Registry SAID",
      "type": "string"
    },
    "s": {
      "description": "Schema Section",
      "oneOf": [
        {
          "description": "Schema Section SAID",
          "type": "string"
        },
        {
          "description": "Schema Section Detail",
          "type": "object"
        }
      ]
    },
    "a": {
      "description": "Attribute Section",
      "oneOf": [
        {
          "description": "Attribute Section SAID",
          "type": "string"
        },
        {
          "description": "Attribute Section Detail",
          "type": "object",
          "required": [
            "d",
            "u",
            "i",
            "givenName",
            "middleName",
            "familyName",
            "birthDate",
            "facialImageProof",
            "legalPresenceStatus",
            "issuedDate",
            "expirationDate"
          ],
          "properties": {
            "d": {
              "description": "Attribute Section SAID",
              "type": "string"
            },
            "u": {
              "description": "Attribute Section UE",
              "type": "string"
            },
            "i": {
              "description": "Issuee SMAID SEDI Management AID",
              "type": "string"
            },
            "rd": {
              "description": "Issuee Presentation Registry SAID",
              "type": "string"
            },
            "givenName": {
              "description": "Given Name Block",
              "type": "object",
              "required": [
                "d",
                "u",
                "value"
              ],
              "properties": {
                "d": {
                  "description": "Block SAID",
                  "type": "string"
                },
                "u": {
                  "description": "Bock UE",
                  "type": "string"
                },
                "value": {
                  "description": "Given Name Value",
                  "type": "string"
                }
              },
              "additionalProperties": false
            },
            "middleName": {
              "description": "Middle Name(s) Block",
              "type": "object",
              "required": [
                "d",
                "u",
                "value"
              ],
              "properties": {
                "d": {
                  "description": "Block SAID",
                  "type": "string"
                },
                "u": {
                  "description": "Bock UE",
                  "type": "string"
                },
                "value": {
                  "description": "Middle Name(s) Value",
                  "type": "string"
                }
              },
              "additionalProperties": false
            },
            "familyName": {
              "description": "Family Name Block",
              "type": "object",
              "required": [
                "d",
                "u",
                "value"
              ],
              "properties": {
                "d": {
                  "description": "Block SAID",
                  "type": "string"
                },
                "u": {
                  "description": "Bock UE",
                  "type": "string"
                },
                "value": {
                  "description": "Family Name Value",
                  "type": "string"
                }
              },
              "additionalProperties": false
            },
            "birthDate": {
              "description": "Birth Date Block",
              "type": "object",
              "required": [
                "d",
                "u",
                "value"
              ],
              "properties": {
                "d": {
                  "description": "Block SAID",
                  "type": "string"
                },
                "u": {
                  "description": "Bock UE",
                  "type": "string"
                },
                "value": {
                  "description": "Birth Date Value as RFC-3339/ISO-8601 time MBZ",
                  "type": "string"
                }
              },
              "additionalProperties": false
            },
            "facialImageProof": {
              "description": "Facial Image Proof Block",
              "type": "object",
              "required": [
                "d",
                "u",
                "value"
              ],
              "properties": {
                "d": {
                  "description": "Block SAID",
                  "type": "string"
                },
                "u": {
                  "description": "Bock UE",
                  "type": "string"
                },
                "value": {
                  "description": "Facial Image Proof Value as SAID of typed media block",
                  "type": "string"
                }
              },
              "additionalProperties": false
            },
            "legalPresenceStatus": {
              "description": "Legal Presense Status Block",
              "type": "object",
              "required": [
                "d",
                "u",
                "value"
              ],
              "properties": {
                "d": {
                  "description": "Block SAID",
                  "type": "string"
                },
                "u": {
                  "description": "Bock UE",
                  "type": "string"
                },
                "value": {
                  "description": "Legal Presense Status Value i.e. citizen",
                  "type": "string"
                }
              },
              "additionalProperties": false
            },
            "issuedDate": {
              "description": "Issued Date Block",
              "type": "object",
              "required": [
                "d",
                "u",
                "value"
              ],
              "properties": {
                "d": {
                  "description": "Block SAID",
                  "type": "string"
                },
                "u": {
                  "description": "Bock UE",
                  "type": "string"
                },
                "value": {
                  "description": "Issued Date Value as RFC-3339/ISO-8601 time MBZ",
                  "type": "string"
                }
              },
              "additionalProperties": false
            },
            "expirationDate": {
              "description": "Expiration Date Block",
              "type": "object",
              "required": [
                "d",
                "u",
                "value"
              ],
              "properties": {
                "d": {
                  "description": "Block SAID",
                  "type": "string"
                },
                "u": {
                  "description": "Bock UE",
                  "type": "string"
                },
                "value": {
                  "description": "Expiration Date Value as RFC-3339/ISO-8601 time MBZ",
                  "type": "string"
                }
              },
              "additionalProperties": false
            }
          },
          "additionalProperties": false
        }
      ]
    },
    "e": {
      "description": "Edge Section",
      "oneOf": [
        {
          "description": "Edge Section SAID",
          "type": "string"
        },
        {
          "description": "Edge Section Detail",
          "type": "object",
          "required": [
            "d",
            "u",
            "utahAgent",
            "guardian"
          ],
          "properties": {
            "d": {
              "description": "Edge Section SAID",
              "type": "string"
            },
            "u": {
              "description": "Edge Section UE",
              "type": "string"
            },
            "utahAgent": {
              "description": "Utah Agent Edge Block",
              "type": "object",
              "required": [
                "d",
                "u",
                "n",
                "s",
                "o"
              ],
              "properties": {
                "d": {
                  "description": "Edge SAID",
                  "type": "string"
                },
                "u": {
                  "description": "Edge UE",
                  "type": "string"
                },
                "n": {
                  "description": "Far Node SAID",
                  "type": "string"
                },
                "s": {
                  "description": "Far Node Schema SAID",
                  "type": "string"
                },
                "o": {
                  "description": "Edge Unary Operator",
                  "type": "string"
                }
              },
              "additionalProperties": false
            },
            "guardian": {
              "description": "NI2I edge to the guardian credential held by someone other than the ward",
              "oneOf": [
                {
                  "type": "string"
                },
                {
                  "type": "object",
                  "required": [
                    "d",
                    "u",
                    "n",
                    "s",
                    "o"
                  ],
                  "properties": {
                    "d": {
                      "description": "Edge SAID",
                      "type": "string"
                    },
                    "u": {
                      "description": "Edge UE",
                      "type": "string"
                    },
                    "n": {
                      "description": "Guardianship credential SAID",
                      "type": "string"
                    },
                    "s": {
                      "description": "Guardian schema SAID",
                      "const": "EGpQePxZPKq9nPF99rI9IawvJgMukfPxjI6WKN8GFVfV"
                    },
                    "o": {
                      "description": "Different-issuee relation",
                      "const": "NI2I"
                    }
                  },
                  "additionalProperties": false
                }
              ]
            }
          },
          "additionalProperties": false
        }
      ]
    },
    "r": {
      "description": "Rule Section",
      "oneOf": [
        {
          "description": "Rule Section SAID",
          "type": "string"
        },
        {
          "description": "Rule Section Detail",
          "type": "object",
          "required": [
            "d",
            "l"
          ],
          "properties": {
            "d": {
              "description": "Rule Section SAID",
              "type": "string"
            },
            "l": {
              "description": "Legal Language",
              "type": "string"
            }
          },
          "additionalProperties": false
        }
      ]
    }
  },
  "additionalProperties": false
}
