{
  "v": "ACDCCAACAAJSONAAdU.",
  "d": "EGPxxCa5ms7K66PacVKPuAt6GQ8Ipb3ztrUv6krQRwYu",
  "i": "EAAAAAAAAAAAAAAAAAAAAAAAAAAAAAAAAAAAAAAAAAAA",
  "rd": "EAAAAAAAAAAAAAAAAAAAAAAAAAAAAAAAAAAAAAAAAAAA",
  "s": "ELadqKgkbacswVsGfxVCYHy4jyfN7W24vGHIR5pPjC18",
  "a": {
    "d": "EPKUBi5zh_6Xj8x-77lmN0E9ZXw1EPLUvh4fFmWhSgcp",
    "u": "0ABzZWRpaWRhdHRybm9uYzAw",
    "i": "EDB8gKNwzurf33pV2hsyGR9XFOmitDhc0LUzDamcU2JR",
    "givenName": {
      "d": "EIhgsh2tsbG1RS3wfPpcet0DSJG1i9VcPRTJXI8LRMoK",
      "u": "0ABzZWRpaWRhdHRybm9uYzAw",
      "value": "example"
    },
    "middleName": {
      "d": "EIhgsh2tsbG1RS3wfPpcet0DSJG1i9VcPRTJXI8LRMoK",
      "u": "0ABzZWRpaWRhdHRybm9uYzAw",
      "value": "example"
    },
    "familyName": {
      "d": "EIhgsh2tsbG1RS3wfPpcet0DSJG1i9VcPRTJXI8LRMoK",
      "u": "0ABzZWRpaWRhdHRybm9uYzAw",
      "value": "example"
    },
    "birthDate": {
      "d": "EIhgsh2tsbG1RS3wfPpcet0DSJG1i9VcPRTJXI8LRMoK",
      "u": "0ABzZWRpaWRhdHRybm9uYzAw",
      "value": "example"
    },
    "facialImageProof": {
      "d": "EIhgsh2tsbG1RS3wfPpcet0DSJG1i9VcPRTJXI8LRMoK",
      "u": "0ABzZWRpaWRhdHRybm9uYzAw",
      "value": "example"
    },
    "legalPresenceStatus": {
      "d": "EIhgsh2tsbG1RS3wfPpcet0DSJG1i9VcPRTJXI8LRMoK",
      "u": "0ABzZWRpaWRhdHRybm9uYzAw",
      "value": "example"
    },
    "issuedDate": {
      "d": "EIhgsh2tsbG1RS3wfPpcet0DSJG1i9VcPRTJXI8LRMoK",
      "u": "0ABzZWRpaWRhdHRybm9uYzAw",
      "value": "example"
    },
    "expirationDate": {
      "d": "EIhgsh2tsbG1RS3wfPpcet0DSJG1i9VcPRTJXI8LRMoK",
      "u": "0ABzZWRpaWRhdHRybm9uYzAw",
      "value": "example"
    }
  },
  "e": {
    "d": "EK7m-PhxfCXABE68FQ8IPynQtGLT0hYCkRn_ersMDc_W",
    "u": "0ABzZWRpaWRhdHRybm9uYzAw",
    "utahAgent": {
      "d": "ECjC_TVVco10HZHheIX_5CXWf0tPwclgXIdEl3VPnLRE",
      "u": "0ABzZWRpaWRhdHRybm9uYzAw",
      "n": "EAAAAAAAAAAAAAAAAAAAAAAAAAAAAAAAAAAAAAAAAAAA",
      "s": "EAyyREL1r5OL8Z9HGl47df26rn_JRLsC7PVDBH5RtwLs",
      "o": "I2I"
    },
    "guardian": {
      "d": "EKAe1nA_ZHiIHWF1ar4MCT3XkS4AYGu2uvrGwPGP2WHP",
      "u": "0ABzZWRpZ3VhcmRlZGdlMDAw",
      "n": "ELLHq23Iuf6G0B1eN35LWuTLLQadye9xd7vTklNeCpjU",
      "s": "EGpQePxZPKq9nPF99rI9IawvJgMukfPxjI6WKN8GFVfV",
      "o": "NI2I"
    }
  },
  "r": {
    "d": "EFPxq4WPl29szUqbrQIviOh_Ls_RlrYbp4L-fdQH0XrX",
    "l": ""
  }
}
